{
  "java_test_rows": 0,
  "production_rows": 62,
  "rows": [
    {
      "java_symbol": "java-tron/.codeclimate.yml",
      "owning_item": "C028.08",
      "production_id": "PROD-6655F2A1024C85BE",
      "proof": {
        "path": "java-tron/.codeclimate.yml",
        "symbol": "sha256:a2a31ebd7184b3d40a74ba5a4826e269bed32c7760437a1b86a542ff111d4d13"
      },
      "reason": "Pinned SHA-256 authenticates the retained Java source at java-tron/.codeclimate.yml; it is reference-only and does not substitute for executable Rust release evidence.",
      "result": "retained_reference_only",
      "source": {
        "line": 1,
        "path": "java-tron/.codeclimate.yml",
        "sha256": "a2a31ebd7184b3d40a74ba5a4826e269bed32c7760437a1b86a542ff111d4d13"
      }
    },
    {
      "java_symbol": "java-tron/.github/ISSUE_TEMPLATE/ask-a-question.md",
      "owning_item": "C028.08",
      "production_id": "PROD-A72A647F4B8A46E6",
      "proof": {
        "path": "java-tron/.github/ISSUE_TEMPLATE/ask-a-question.md",
        "symbol": "sha256:b56ddbf98d49f04663ccc18543bce083ede90e186f02870ea33f4d8354551551"
      },
      "reason": "Pinned SHA-256 authenticates the retained Java source at java-tron/.github/ISSUE_TEMPLATE/ask-a-question.md; it is reference-only and does not substitute for executable Rust release evidence.",
      "result": "retained_reference_only",
      "source": {
        "line": 1,
        "path": "java-tron/.github/ISSUE_TEMPLATE/ask-a-question.md",
        "sha256": "b56ddbf98d49f04663ccc18543bce083ede90e186f02870ea33f4d8354551551"
      }
    },
    {
      "java_symbol": "java-tron/.github/ISSUE_TEMPLATE/report-a-bug.md",
      "owning_item": "C028.08",
      "production_id": "PROD-5C2E9ED5F6F979ED",
      "proof": {
        "path": "java-tron/.github/ISSUE_TEMPLATE/report-a-bug.md",
        "symbol": "sha256:e730087ef2a4a689fa7a1208c433832245257fa3b53b4d8c109cd2516259be77"
      },
      "reason": "Pinned SHA-256 authenticates the retained Java source at java-tron/.github/ISSUE_TEMPLATE/report-a-bug.md; it is reference-only and does not substitute for executable Rust release evidence.",
      "result": "retained_reference_only",
      "source": {
        "line": 1,
        "path": "java-tron/.github/ISSUE_TEMPLATE/report-a-bug.md",
        "sha256": "e730087ef2a4a689fa7a1208c433832245257fa3b53b4d8c109cd2516259be77"
      }
    },
    {
      "java_symbol": "java-tron/.github/ISSUE_TEMPLATE/request-a-feature.md",
      "owning_item": "C028.08",
      "production_id": "PROD-62FF8B053672D87A",
      "proof": {
        "path": "java-tron/.github/ISSUE_TEMPLATE/request-a-feature.md",
        "symbol": "sha256:238f7fa0ca0508e98097ac2051df32a66477cf3adb329089a2cae4620abcef30"
      },
      "reason": "Pinned SHA-256 authenticates the retained Java source at java-tron/.github/ISSUE_TEMPLATE/request-a-feature.md; it is reference-only and does not substitute for executable Rust release evidence.",
      "result": "retained_reference_only",
      "source": {
        "line": 1,
        "path": "java-tron/.github/ISSUE_TEMPLATE/request-a-feature.md",
        "sha256": "238f7fa0ca0508e98097ac2051df32a66477cf3adb329089a2cae4620abcef30"
      }
    },
    {
      "java_symbol": "java-tron/.github/PULL_REQUEST_TEMPLATE.md",
      "owning_item": "C028.08",
      "production_id": "PROD-E84C7BD8068158D3",
      "proof": {
        "path": "java-tron/.github/PULL_REQUEST_TEMPLATE.md",
        "symbol": "sha256:9d974853e2d71ea343a7709e51c3c1031e467634b52c1e44db8411c882692330"
      },
      "reason": "Pinned SHA-256 authenticates the retained Java source at java-tron/.github/PULL_REQUEST_TEMPLATE.md; it is reference-only and does not substitute for executable Rust release evidence.",
      "result": "retained_reference_only",
      "source": {
        "line": 1,
        "path": "java-tron/.github/PULL_REQUEST_TEMPLATE.md",
        "sha256": "9d974853e2d71ea343a7709e51c3c1031e467634b52c1e44db8411c882692330"
      }
    },
    {
      "java_symbol": "java-tron/.github/scripts/requirements.txt",
      "owning_item": "C028.08",
      "production_id": "PROD-F7B5F6611B54F182",
      "proof": {
        "path": "java-tron/.github/scripts/requirements.txt",
        "symbol": "sha256:ba68723455ba6e9335000758e02b6f4411c3ef13fbd2fb9e3b5c9ff1a6368ba3"
      },
      "reason": "Pinned SHA-256 authenticates the retained Java source at java-tron/.github/scripts/requirements.txt; it is reference-only and does not substitute for executable Rust release evidence.",
      "result": "retained_reference_only",
      "source": {
        "line": 1,
        "path": "java-tron/.github/scripts/requirements.txt",
        "sha256": "ba68723455ba6e9335000758e02b6f4411c3ef13fbd2fb9e3b5c9ff1a6368ba3"
      }
    },
    {
      "java_symbol": "java-tron/.github/workflows/codeql.yml",
      "owning_item": "C028.08",
      "production_id": "PROD-4588739B09F231D6",
      "proof": {
        "path": "java-tron/.github/workflows/codeql.yml",
        "symbol": "sha256:8ea4c8171ae4e26f376871b00d613184064fdafeebb56058e3f664c53693f6e0"
      },
      "reason": "Pinned SHA-256 authenticates the retained Java source at java-tron/.github/workflows/codeql.yml; it is reference-only and does not substitute for executable Rust release evidence.",
      "result": "retained_reference_only",
      "source": {
        "line": 1,
        "path": "java-tron/.github/workflows/codeql.yml",
        "sha256": "8ea4c8171ae4e26f376871b00d613184064fdafeebb56058e3f664c53693f6e0"
      }
    },
    {
      "java_symbol": "java-tron/.github/workflows/integration-test-single-node.yml",
      "owning_item": "C028.08",
      "production_id": "PROD-5941EA6E8C47A987",
      "proof": {
        "path": "java-tron/.github/workflows/integration-test-single-node.yml",
        "symbol": "sha256:bcc5b00acd5fcdf37b06f7e4a99701455d03f12086be4b1d14aa9a138c9b662a"
      },
      "reason": "Pinned SHA-256 authenticates the retained Java source at java-tron/.github/workflows/integration-test-single-node.yml; it is reference-only and does not substitute for executable Rust release evidence.",
      "result": "retained_reference_only",
      "source": {
        "line": 1,
        "path": "java-tron/.github/workflows/integration-test-single-node.yml",
        "sha256": "bcc5b00acd5fcdf37b06f7e4a99701455d03f12086be4b1d14aa9a138c9b662a"
      }
    },
    {
      "java_symbol": "java-tron/.github/workflows/math-check.yml",
      "owning_item": "C028.08",
      "production_id": "PROD-CDE0CEC6BB071890",
      "proof": {
        "path": "java-tron/.github/workflows/math-check.yml",
        "symbol": "sha256:99da8687769b09d1ae74c670efa967ee330c3db86558e7e787ebc405ce8b2c20"
      },
      "reason": "Pinned SHA-256 authenticates the retained Java source at java-tron/.github/workflows/math-check.yml; it is reference-only and does not substitute for executable Rust release evidence.",
      "result": "retained_reference_only",
      "source": {
        "line": 1,
        "path": "java-tron/.github/workflows/math-check.yml",
        "sha256": "99da8687769b09d1ae74c670efa967ee330c3db86558e7e787ebc405ce8b2c20"
      }
    },
    {
      "java_symbol": "java-tron/.github/workflows/pr-build.yml",
      "owning_item": "C028.08",
      "production_id": "PROD-77DD7EAF3FFB296E",
      "proof": {
        "path": "java-tron/.github/workflows/pr-build.yml",
        "symbol": "sha256:a29186bab5f4d07082d8a050d6729779f0db33ea6096cdc26cd30c3b0d6c8e57"
      },
      "reason": "Pinned SHA-256 authenticates the retained Java source at java-tron/.github/workflows/pr-build.yml; it is reference-only and does not substitute for executable Rust release evidence.",
      "result": "retained_reference_only",
      "source": {
        "line": 1,
        "path": "java-tron/.github/workflows/pr-build.yml",
        "sha256": "a29186bab5f4d07082d8a050d6729779f0db33ea6096cdc26cd30c3b0d6c8e57"
      }
    },
    {
      "java_symbol": "java-tron/.github/workflows/pr-cancel.yml",
      "owning_item": "C028.08",
      "production_id": "PROD-021C6E29015D2BAA",
      "proof": {
        "path": "java-tron/.github/workflows/pr-cancel.yml",
        "symbol": "sha256:d8106763e0b7ae556d5d85641e4eba95bba228a4d0e2797424eac6085dd2ab2e"
      },
      "reason": "Pinned SHA-256 authenticates the retained Java source at java-tron/.github/workflows/pr-cancel.yml; it is reference-only and does not substitute for executable Rust release evidence.",
      "result": "retained_reference_only",
      "source": {
        "line": 1,
        "path": "java-tron/.github/workflows/pr-cancel.yml",
        "sha256": "d8106763e0b7ae556d5d85641e4eba95bba228a4d0e2797424eac6085dd2ab2e"
      }
    },
    {
      "java_symbol": "java-tron/.github/workflows/pr-check.yml",
      "owning_item": "C028.08",
      "production_id": "PROD-88C3245053199481",
      "proof": {
        "path": "java-tron/.github/workflows/pr-check.yml",
        "symbol": "sha256:1d588566ea54db6305904401ecb03982dcd8f5afeb7676ec43a272147a8378f2"
      },
      "reason": "Pinned SHA-256 authenticates the retained Java source at java-tron/.github/workflows/pr-check.yml; it is reference-only and does not substitute for executable Rust release evidence.",
      "result": "retained_reference_only",
      "source": {
        "line": 1,
        "path": "java-tron/.github/workflows/pr-check.yml",
        "sha256": "1d588566ea54db6305904401ecb03982dcd8f5afeb7676ec43a272147a8378f2"
      }
    },
    {
      "java_symbol": "java-tron/.github/workflows/pr-reviewer.yml",
      "owning_item": "C028.08",
      "production_id": "PROD-72776BF54EC07A5B",
      "proof": {
        "path": "java-tron/.github/workflows/pr-reviewer.yml",
        "symbol": "sha256:730c625e3fb0a36efd970201fdd0a61a2798b7db130a860b5a46dc75ec5af550"
      },